{
  "$schema": "https://json-schema.org/draft/2020-12/schema",
  "$id": "urn:mindmap-cli:contract:1:document",
  "type": "object",
  "properties": {
    "JSON-SchemaVersion": {
      "const": 2
    },
    "metadata": {
      "type": "object",
      "properties": {
        "id": {
          "type": "string",
          "pattern": "^[A-Za-z0-9][A-Za-z0-9._:-]{0,127}$",
          "maxLength": 128
        },
        "title": {
          "type": "string",
          "pattern": "^\\S(?:[\\s\\S]*\\S)?$"
        },
        "graphVersion": {
          "type": "integer",
          "minimum": 0,
          "maximum": 9007199254740991
        },
        "createdAt": {
          "type": "string",
          "pattern": "^\\d{4}-\\d{2}-\\d{2}T\\d{2}:\\d{2}:\\d{2}\\.\\d{3}Z$"
        },
        "updatedAt": {
          "type": "string",
          "pattern": "^\\d{4}-\\d{2}-\\d{2}T\\d{2}:\\d{2}:\\d{2}\\.\\d{3}Z$"
        }
      },
      "required": [
        "id",
        "title",
        "graphVersion",
        "createdAt",
        "updatedAt"
      ],
      "additionalProperties": false
    },
    "graph": {
      "type": "object",
      "properties": {
        "topology": {
          "const": "directed"
        },
        "semanticType": {
          "type": "string",
          "pattern": "^\\S(?:[\\s\\S]*\\S)?$"
        },
        "entryNodeId": {
          "anyOf": [
            {
              "type": "string",
              "pattern": "^[A-Za-z0-9][A-Za-z0-9._:-]{0,127}$",
              "maxLength": 128
            },
            {
              "type": "null"
            }
          ]
        },
        "nodes": {
          "type": "object",
          "propertyNames": {
            "type": "string",
            "pattern": "^[A-Za-z0-9][A-Za-z0-9._:-]{0,127}$",
            "maxLength": 128
          },
          "additionalProperties": {
            "type": "object",
            "properties": {
              "id": {
                "type": "string",
                "pattern": "^[A-Za-z0-9][A-Za-z0-9._:-]{0,127}$",
                "maxLength": 128
              },
              "title": {
                "type": "string",
                "pattern": "^\\S(?:[\\s\\S]*\\S)?$"
              },
              "cardContent": {
                "type": "string"
              },
              "notes": {
                "type": "string"
              },
              "meta": {
                "type": "object",
                "additionalProperties": {
                  "$ref": "#/$defs/jsonValue"
                }
              }
            },
            "required": [
              "id",
              "title",
              "cardContent",
              "notes",
              "meta"
            ],
            "additionalProperties": false
          }
        },
        "edges": {
          "type": "object",
          "propertyNames": {
            "type": "string",
            "pattern": "^[A-Za-z0-9][A-Za-z0-9._:-]{0,127}$",
            "maxLength": 128
          },
          "additionalProperties": {
            "type": "object",
            "properties": {
              "id": {
                "type": "string",
                "pattern": "^[A-Za-z0-9][A-Za-z0-9._:-]{0,127}$",
                "maxLength": 128
              },
              "source": {
                "type": "string",
                "pattern": "^[A-Za-z0-9][A-Za-z0-9._:-]{0,127}$",
                "maxLength": 128
              },
              "target": {
                "type": "string",
                "pattern": "^[A-Za-z0-9][A-Za-z0-9._:-]{0,127}$",
                "maxLength": 128
              },
              "kind": {
                "type": "string",
                "pattern": "^\\S(?:[\\s\\S]*\\S)?$"
              },
              "order": {
                "type": "integer",
                "minimum": 0,
                "maximum": 9007199254740991
              },
              "meta": {
                "type": "object",
                "additionalProperties": {
                  "$ref": "#/$defs/jsonValue"
                }
              }
            },
            "required": [
              "id",
              "source",
              "target",
              "kind",
              "meta"
            ],
            "additionalProperties": false
          }
        }
      },
      "required": [
        "topology",
        "semanticType",
        "entryNodeId",
        "nodes",
        "edges"
      ],
      "additionalProperties": false
    },
    "commits": {
      "type": "array",
      "items": {
        "type": "object",
        "properties": {
          "operationId": {
            "type": "string",
            "pattern": "^[A-Za-z0-9][A-Za-z0-9._:-]{0,127}$",
            "maxLength": 128
          },
          "requestHash": {
            "type": "string",
            "pattern": "^[a-f0-9]{64}$"
          },
          "baseGraphVersion": {
            "type": "integer",
            "minimum": 0,
            "maximum": 9007199254740991
          },
          "committedGraphVersion": {
            "type": "integer",
            "minimum": 1,
            "maximum": 9007199254740991
          },
          "committedAt": {
            "type": "string",
            "pattern": "^\\d{4}-\\d{2}-\\d{2}T\\d{2}:\\d{2}:\\d{2}\\.\\d{3}Z$"
          },
          "actor": {
            "type": "object",
            "properties": {
              "kind": {
                "enum": [
                  "human",
                  "agent",
                  "system"
                ]
              },
              "name": {
                "type": "string",
                "pattern": "\\S"
              }
            },
            "required": [
              "kind",
              "name"
            ],
            "additionalProperties": false
          },
          "affectedNodeIds": {
            "type": "array",
            "items": {
              "type": "string",
              "pattern": "^[A-Za-z0-9][A-Za-z0-9._:-]{0,127}$",
              "maxLength": 128
            },
            "uniqueItems": true
          },
          "affectedEdgeIds": {
            "type": "array",
            "items": {
              "type": "string",
              "pattern": "^[A-Za-z0-9][A-Za-z0-9._:-]{0,127}$",
              "maxLength": 128
            },
            "uniqueItems": true
          },
          "summary": {
            "type": "object",
            "properties": {
              "operationCount": {
                "type": "integer",
                "minimum": 1,
                "maximum": 10000
              },
              "nodeCount": {
                "type": "integer",
                "minimum": 0,
                "maximum": 9007199254740991
              },
              "edgeCount": {
                "type": "integer",
                "minimum": 0,
                "maximum": 9007199254740991
              }
            },
            "required": [
              "operationCount",
              "nodeCount",
              "edgeCount"
            ],
            "additionalProperties": false
          }
        },
        "required": [
          "operationId",
          "requestHash",
          "baseGraphVersion",
          "committedGraphVersion",
          "committedAt",
          "affectedNodeIds",
          "affectedEdgeIds",
          "summary"
        ],
        "additionalProperties": false
      }
    }
  },
  "required": [
    "JSON-SchemaVersion",
    "metadata",
    "graph",
    "commits"
  ],
  "additionalProperties": false,
  "$defs": {
    "jsonValue": {
      "anyOf": [
        {
          "type": "null"
        },
        {
          "type": "boolean"
        },
        {
          "type": "string"
        },
        {
          "type": "number"
        },
        {
          "type": "array",
          "items": {
            "$ref": "#/$defs/jsonValue"
          }
        },
        {
          "type": "object",
          "additionalProperties": {
            "$ref": "#/$defs/jsonValue"
          }
        }
      ]
    }
  }
}
