{
  "JSON-SchemaVersion": 2,
  "metadata": {
    "id": "network",
    "title": "服务关系网络",
    "graphVersion": 0,
    "createdAt": "2026-09-05T00:00:00.000Z",
    "updatedAt": "2026-09-05T00:00:00.000Z"
  },
  "graph": {
    "topology": "directed",
    "semanticType": "network",
    "entryNodeId": "client",
    "nodes": {
      "client": {
        "id": "client",
        "title": "客户端",
        "cardContent": "",
        "notes": "",
        "meta": {}
      },
      "api": {
        "id": "api",
        "title": "API 服务",
        "cardContent": "",
        "notes": "",
        "meta": {}
      },
      "store": {
        "id": "store",
        "title": "存储",
        "cardContent": "",
        "notes": "",
        "meta": {}
      },
      "auth": {
        "id": "auth",
        "title": "鉴权服务",
        "cardContent": "",
        "notes": "",
        "meta": {}
      },
      "events": {
        "id": "events",
        "title": "事件中心",
        "cardContent": "",
        "notes": "",
        "meta": {}
      },
      "observer": {
        "id": "observer",
        "title": "独立观察者",
        "cardContent": "",
        "notes": "",
        "meta": {}
      }
    },
    "edges": {
      "e01": {
        "id": "e01",
        "source": "client",
        "target": "api",
        "kind": "请求",
        "meta": {}
      },
      "e02": {
        "id": "e02",
        "source": "api",
        "target": "client",
        "kind": "响应",
        "meta": {}
      },
      "e03": {
        "id": "e03",
        "source": "api",
        "target": "store",
        "kind": "读写",
        "meta": {}
      },
      "e04": {
        "id": "e04",
        "source": "api",
        "target": "auth",
        "kind": "身份校验",
        "meta": {}
      },
      "e05": {
        "id": "e05",
        "source": "auth",
        "target": "events",
        "kind": "发送事件",
        "meta": {}
      },
      "e06": {
        "id": "e06",
        "source": "events",
        "target": "api",
        "kind": "回调",
        "meta": {}
      },
      "e07": {
        "id": "e07",
        "source": "client",
        "target": "api",
        "kind": "订阅",
        "meta": {}
      },
      "e08": {
        "id": "e08",
        "source": "store",
        "target": "store",
        "kind": "维护",
        "meta": {}
      }
    }
  },
  "commits": []
}
