{
  "JSON-SchemaVersion": 2,
  "metadata": {
    "id": "dependency",
    "title": "模块依赖",
    "graphVersion": 0,
    "createdAt": "2026-09-05T00:00:00.000Z",
    "updatedAt": "2026-09-05T00:00:00.000Z"
  },
  "graph": {
    "topology": "directed",
    "semanticType": "dependency",
    "entryNodeId": "base",
    "nodes": {
      "base": {
        "id": "base",
        "title": "基础数据",
        "cardContent": "",
        "notes": "",
        "meta": {}
      },
      "core": {
        "id": "core",
        "title": "图核心",
        "cardContent": "",
        "notes": "",
        "meta": {}
      },
      "layout": {
        "id": "layout",
        "title": "布局模块",
        "cardContent": "",
        "notes": "",
        "meta": {}
      },
      "metrics": {
        "id": "metrics",
        "title": "尺寸计算",
        "cardContent": "",
        "notes": "",
        "meta": {}
      },
      "cli": {
        "id": "cli",
        "title": "CLI 入口",
        "cardContent": "",
        "notes": "",
        "meta": {}
      },
      "optional": {
        "id": "optional",
        "title": "独立工具",
        "cardContent": "",
        "notes": "",
        "meta": {}
      }
    },
    "edges": {
      "e01": {
        "id": "e01",
        "source": "base",
        "target": "core",
        "kind": "先于",
        "meta": {}
      },
      "e02": {
        "id": "e02",
        "source": "core",
        "target": "layout",
        "kind": "先于",
        "meta": {}
      },
      "e03": {
        "id": "e03",
        "source": "layout",
        "target": "metrics",
        "kind": "依赖",
        "meta": {}
      },
      "e04": {
        "id": "e04",
        "source": "metrics",
        "target": "layout",
        "kind": "依赖",
        "meta": {}
      },
      "e05": {
        "id": "e05",
        "source": "layout",
        "target": "cli",
        "kind": "先于",
        "meta": {}
      },
      "e06": {
        "id": "e06",
        "source": "core",
        "target": "cli",
        "kind": "先于",
        "meta": {}
      }
    }
  },
  "commits": []
}
